[I 2023-04-16 08:22:02,590] Trial 73 finished with value: 0.6128541812384608 and parameters: {'criterion': 'entropy', 'min_samples_split': 4225, 'min_samples_leaf': 9, 'max_features': 'log2', 'n_estimators': 1007, 'max_depth': 1.82578878754982}. Best is trial 64 with value: 0.6351623849222102.
[I 2023-04-16 08:22:05,003] Trial 74 finished with value: 0.5026593445370737 and parameters: {'criterion': 'entropy', 'min_samples_split': 7142, 'min_samples_leaf': 10, 'max_features': 'log2', 'n_estimators': 585, 'max_depth': 2.366978603834861}. Best is trial 64 with value: 0.6351623849222102.
[I 2023-04-16 08:22:09,033] Trial 75 finished with value: 0.6169815749510073 and parameters: {'criterion': 'gini', 'min_samples_split': 1220, 'min_samples_leaf': 9, 'max_features': 'log2', 'n_estimators': 783, 'max_depth': 1.5443536210053508}. Best is trial 64 with value: 0.6351623849222102.
[I 2023-04-16 08:22:11,751] Trial 76 finished with value: 0.6290494779359408 and parameters: {'criterion': 'entropy', 'min_samples_split': 74, 'min_samples_leaf': 9, 'max_features': 'log2', 'n_estimators': 507, 'max_depth': 1.8639879603732084}. Best is trial 64 with value: 0.6351623849222102.
[I 2023-04-16 08:22:13,991] Trial 77 finished with value: 0.6087257478087172 and parameters: {'criterion': 'entropy', 'min_samples_split': 424, 'min_samples_leaf': 10, 'max_features': 'log2', 'n_estimators': 331, 'max_depth': 2.8341157388909513}. Best is trial 64 with value: 0.6351623849222102.
[I 2023-04-16 08:22:17,767] Trial 78 finished with value: 0.5572812025432113 and parameters: {'criterion': 'entropy', 'min_samples_split': 3503, 'min_samples_leaf': 9, 'max_features': 'sqrt', 'n_estimators': 529, 'max_depth': 1.8567427923915991}. Best is trial 64 with value: 0.6351623849222102.
[I 2023-04-16 08:22:19,626] Trial 79 finished with value: 0.5959447248530219 and parameters: {'criterion': 'entropy', 'min_samples_split': 159, 'min_samples_leaf': 1, 'max_features': 'log2', 'n_estimators': 348, 'max_depth': 1.289856024719078}. Best is trial 64 with value: 0.6351623849222102.
[I 2023-04-16 08:22:22,844] Trial 80 finished with value: 0.5995166260231761 and parameters: {'criterion': 'entropy', 'min_samples_split': 3391, 'min_samples_leaf': 10, 'max_features': 'log2', 'n_estimators': 410, 'max_depth': 3.410950747343493}. Best is trial 64 with value: 0.6351623849222102.
[I 2023-04-16 08:22:25,890] Trial 81 finished with value: 0.6042787198245714 and parameters: {'criterion': 'entropy', 'min_samples_split': 5741, 'min_samples_leaf': 6, 'max_features': 'log2', 'n_estimators': 649, 'max_depth': 1.0286196387392728}. Best is trial 64 with value: 0.6351623849222102.
[I 2023-04-16 08:22:29,758] Trial 82 finished with value: 0.6094392143518781 and parameters: {'criterion': 'gini', 'min_samples_split': 1386, 'min_samples_leaf': 9, 'max_features': 'log2', 'n_estimators': 874, 'max_depth': 1.5813137879373231}. Best is trial 64 with value: 0.6351623849222102.
[I 2023-04-16 08:22:31,788] Trial 83 finished with value: 0.5026593445370737 and parameters: {'criterion': 'entropy', 'min_samples_split': 17068, 'min_samples_leaf': 10, 'max_features': 'log2', 'n_estimators': 686, 'max_depth': 2.140818473881845}. Best is trial 64 with value: 0.6351623849222102.
[I 2023-04-16 08:22:35,356] Trial 84 finished with value: 0.5984039710895607 and parameters: {'criterion': 'entropy', 'min_samples_split': 2830, 'min_samples_leaf': 9, 'max_features': 'log2', 'n_estimators': 775, 'max_depth': 1.0046119482868494}. Best is trial 64 with value: 0.6351623849222102.
[I 2023-04-16 08:22:37,089] Trial 85 finished with value: 0.5026593445370737 and parameters: {'criterion': 'log_loss', 'min_samples_split': 6598, 'min_samples_leaf': 10, 'max_features': 'log2', 'n_estimators': 615, 'max_depth': 1.3383315224701422}. Best is trial 64 with value: 0.6351623849222102.
[I 2023-04-16 08:22:42,622] Trial 86 finished with value: 0.6116618461596628 and parameters: {'criterion': 'gini', 'min_samples_split': 4208, 'min_samples_leaf': 10, 'max_features': 'log2', 'n_estimators': 1300, 'max_depth': 1.5858223502429194}. Best is trial 64 with value: 0.6351623849222102.
[I 2023-04-16 08:22:45,406] Trial 87 finished with value: 0.5026593445370737 and parameters: {'criterion': 'entropy', 'min_samples_split': 7744, 'min_samples_leaf': 4, 'max_features': 'log2', 'n_estimators': 1058, 'max_depth': 1.1731721972756897}. Best is trial 64 with value: 0.6351623849222102.
[I 2023-04-16 08:22:47,695] Trial 88 finished with value: 0.5026593445370737 and parameters: {'criterion': 'entropy', 'min_samples_split': 9945, 'min_samples_leaf': 9, 'max_features': 'log2', 'n_estimators': 739, 'max_depth': 1.828695488489449}. Best is trial 64 with value: 0.6351623849222102.
[I 2023-04-16 08:22:56,991] Trial 89 finished with value: 0.5568050120670207 and parameters: {'criterion': 'entropy', 'min_samples_split': 1729, 'min_samples_leaf': 10, 'max_features': 'sqrt', 'n_estimators': 911, 'max_depth': 2.476200670837818}. Best is trial 64 with value: 0.6351623849222102.
[I 2023-04-16 08:23:01,198] Trial 90 finished with value: 0.6169831502800937 and parameters: {'criterion': 'gini', 'min_samples_split': 5196, 'min_samples_leaf': 10, 'max_features': 'log2', 'n_estimators': 969, 'max_depth': 1.2450615673266734}. Best is trial 64 with value: 0.6351623849222102.
[I 2023-04-16 08:23:06,319] Trial 91 finished with value: 0.6241290950679598 and parameters: {'criterion': 'gini', 'min_samples_split': 5275, 'min_samples_leaf': 10, 'max_features': 'log2', 'n_estimators': 1112, 'max_depth': 1.4662214325876874}. Best is trial 64 with value: 0.6351623849222102.
[I 2023-04-16 08:23:10,114] Trial 92 finished with value: 0.6121376270502907 and parameters: {'criterion': 'gini', 'min_samples_split': 2626, 'min_samples_leaf': 10, 'max_features': 'log2', 'n_estimators': 841, 'max_depth': 1.534992760397413}. Best is trial 64 with value: 0.6351623849222102.
[I 2023-04-16 08:23:17,761] Trial 93 finished with value: 0.6080904175882342 and parameters: {'criterion': 'gini', 'min_samples_split': 3738, 'min_samples_leaf': 10, 'max_features': 'log2', 'n_estimators': 1334, 'max_depth': 2.1438481843039394}. Best is trial 64 with value: 0.6351623849222102.
[I 2023-04-16 08:23:18,667] Trial 94 finished with value: 0.5026593445370737 and parameters: {'criterion': 'gini', 'min_samples_split': 8935, 'min_samples_leaf': 9, 'max_features': 'log2', 'n_estimators': 224, 'max_depth': 1.164417691624024}. Best is trial 64 with value: 0.6351623849222102.
[I 2023-04-16 08:23:23,820] Trial 95 finished with value: 0.6093594081803689 and parameters: {'criterion': 'gini', 'min_samples_split': 5900, 'min_samples_leaf': 10, 'max_features': 'log2', 'n_estimators': 1155, 'max_depth': 1.4469725886175204}. Best is trial 64 with value: 0.6351623849222102.
[I 2023-04-16 08:23:26,887] Trial 96 finished with value: 0.6075329086246116 and parameters: {'criterion': 'entropy', 'min_samples_split': 1257, 'min_samples_leaf': 9, 'max_features': 'log2', 'n_estimators': 548, 'max_depth': 1.6488756091841539}. Best is trial 64 with value: 0.6351623849222102.
[I 2023-04-16 08:23:31,386] Trial 97 finished with value: 0.5026593445370737 and parameters: {'criterion': 'gini', 'min_samples_split': 11588, 'min_samples_leaf': 10, 'max_features': 'log2', 'n_estimators': 1622, 'max_depth': 1.1672481098086265}. Best is trial 64 with value: 0.6351623849222102.
[I 2023-04-16 08:23:33,901] Trial 98 finished with value: 0.6116631064229319 and parameters: {'criterion': 'entropy', 'min_samples_split': 4932, 'min_samples_leaf': 9, 'max_features': 'log2', 'n_estimators': 494, 'max_depth': 1.9002436358738264}. Best is trial 64 with value: 0.6351623849222102.
[I 2023-04-16 08:23:36,033] Trial 99 finished with value: 0.5026593445370737 and parameters: {'criterion': 'log_loss', 'min_samples_split': 7912, 'min_samples_leaf': 2, 'max_features': 'log2', 'n_estimators': 748, 'max_depth': 2.3049568089518484}. Best is trial 64 with value: 0.6351623849222102.
[I 2023-04-16 08:23:38,849] Trial 100 finished with value: 0.6324657050857925 and parameters: {'criterion': 'entropy', 'min_samples_split': 2537, 'min_samples_leaf': 10, 'max_features': 'log2', 'n_estimators': 605, 'max_depth': 1.3940188483378708}. Best is trial 64 with value: 0.6351623849222102.
[I 2023-04-16 08:23:41,555] Trial 101 finished with value: 0.6118997838648494 and parameters: {'criterion': 'entropy', 'min_samples_split': 2258, 'min_samples_leaf': 10, 'max_features': 'log2', 'n_estimators': 582, 'max_depth': 1.0050452010914834}. Best is trial 64 with value: 0.6351623849222102.
[I 2023-04-16 08:23:43,788] Trial 102 finished with value: 0.6325424236122925 and parameters: {'criterion': 'entropy', 'min_samples_split': 110, 'min_samples_leaf': 10, 'max_features': 'log2', 'n_estimators': 430, 'max_depth': 1.402785349604575}. Best is trial 64 with value: 0.6351623849222102.
[I 2023-04-16 08:23:45,930] Trial 103 finished with value: 0.633575272374399 and parameters: {'criterion': 'entropy', 'min_samples_split': 187, 'min_samples_leaf': 10, 'max_features': 'log2', 'n_estimators': 413, 'max_depth': 1.3917720923751817}. Best is trial 64 with value: 0.6351623849222102.
[I 2023-04-16 08:23:48,200] Trial 104 finished with value: 0.6072980900710159 and parameters: {'criterion': 'entropy', 'min_samples_split': 349, 'min_samples_leaf': 10, 'max_features': 'log2', 'n_estimators': 405, 'max_depth': 1.4144784025335055}. Best is trial 64 with value: 0.6351623849222102.
[I 2023-04-16 08:23:50,563] Trial 105 finished with value: 0.6053104973628992 and parameters: {'criterion': 'entropy', 'min_samples_split': 984, 'min_samples_leaf': 10, 'max_features': 'log2', 'n_estimators': 442, 'max_depth': 1.7085783250259214}. Best is trial 64 with value: 0.6351623849222102.
[I 2023-04-16 08:23:52,135] Trial 106 finished with value: 0.6006278316540324 and parameters: {'criterion': 'entropy', 'min_samples_split': 67, 'min_samples_leaf': 10, 'max_features': 'log2', 'n_estimators': 195, 'max_depth': 2.7947901494020386}. Best is trial 64 with value: 0.6351623849222102.
[I 2023-04-16 08:23:54,623] Trial 107 finished with value: 0.6328607346074595 and parameters: {'criterion': 'entropy', 'min_samples_split': 2497, 'min_samples_leaf': 10, 'max_features': 'log2', 'n_estimators': 504, 'max_depth': 1.9499710903991192}. Best is trial 64 with value: 0.6351623849222102.
[I 2023-04-16 08:24:00,057] Trial 108 finished with value: 0.5576786580716712 and parameters: {'criterion': 'entropy', 'min_samples_split': 2101, 'min_samples_leaf': 10, 'max_features': 'sqrt', 'n_estimators': 372, 'max_depth': 3.289776618298878}. Best is trial 64 with value: 0.6351623849222102.
[I 2023-04-16 08:24:02,079] Trial 109 finished with value: 0.5985633943930886 and parameters: {'criterion': 'entropy', 'min_samples_split': 3018, 'min_samples_leaf': 10, 'max_features': 'log2', 'n_estimators': 285, 'max_depth': 2.070836604920125}. Best is trial 64 with value: 0.6351623849222102.
[I 2023-04-16 08:24:06,601] Trial 110 finished with value: 0.6037243300125396 and parameters: {'criterion': 'entropy', 'min_samples_split': 1272, 'min_samples_leaf': 9, 'max_features': 'log2', 'n_estimators': 514, 'max_depth': 4.123584985695231}. Best is trial 64 with value: 0.6351623849222102.
[I 2023-04-16 08:24:08,820] Trial 111 finished with value: 0.6006268234434173 and parameters: {'criterion': 'entropy', 'min_samples_split': 3553, 'min_samples_leaf': 10, 'max_features': 'log2', 'n_estimators': 451, 'max_depth': 1.4112783564856628}. Best is trial 64 with value: 0.6351623849222102.
[I 2023-04-16 08:24:11,755] Trial 112 finished with value: 0.6357983767809096 and parameters: {'criterion': 'entropy', 'min_samples_split': 2315, 'min_samples_leaf': 10, 'max_features': 'log2', 'n_estimators': 614, 'max_depth': 1.202313041266765}. Best is trial 112 with value: 0.6357983767809096.
[I 2023-04-16 08:24:14,646] Trial 113 finished with value: 0.6256351726875744 and parameters: {'criterion': 'entropy', 'min_samples_split': 15, 'min_samples_leaf': 10, 'max_features': 'log2', 'n_estimators': 588, 'max_depth': 1.7626605724585618}. Best is trial 112 with value: 0.6357983767809096.
[I 2023-04-16 08:24:17,519] Trial 114 finished with value: 0.6084862347744444 and parameters: {'criterion': 'entropy', 'min_samples_split': 2203, 'min_samples_leaf': 10, 'max_features': 'log2', 'n_estimators': 620, 'max_depth': 1.9266390198022072}. Best is trial 112 with value: 0.6357983767809096.
[I 2023-04-16 08:24:21,093] Trial 115 finished with value: 0.5972943722943723 and parameters: {'criterion': 'entropy', 'min_samples_split': 951, 'min_samples_leaf': 10, 'max_features': 'log2', 'n_estimators': 565, 'max_depth': 2.5014345167115106}. Best is trial 112 with value: 0.6357983767809096.
[I 2023-04-16 08:24:23,440] Trial 116 finished with value: 0.6167433536865851 and parameters: {'criterion': 'entropy', 'min_samples_split': 2700, 'min_samples_leaf': 9, 'max_features': 'log2', 'n_estimators': 473, 'max_depth': 1.6547448487135283}. Best is trial 112 with value: 0.6357983767809096.
[I 2023-04-16 08:24:25,464] Trial 117 finished with value: 0.6099143651108717 and parameters: {'criterion': 'entropy', 'min_samples_split': 181, 'min_samples_leaf': 10, 'max_features': 'log2', 'n_estimators': 408, 'max_depth': 1.265591659445787}. Best is trial 112 with value: 0.6357983767809096.
[I 2023-04-16 08:24:29,338] Trial 118 finished with value: 0.6058667775698343 and parameters: {'criterion': 'entropy', 'min_samples_split': 1918, 'min_samples_leaf': 10, 'max_features': 'log2', 'n_estimators': 654, 'max_depth': 2.9688111556566046}. Best is trial 112 with value: 0.6357983767809096.
[I 2023-04-16 08:24:30,891] Trial 119 finished with value: 0.5026593445370737 and parameters: {'criterion': 'entropy', 'min_samples_split': 42758, 'min_samples_leaf': 10, 'max_features': 'log2', 'n_estimators': 513, 'max_depth': 1.1839171235980792}. Best is trial 112 with value: 0.6357983767809096.
[I 2023-04-16 08:24:34,536] Trial 120 finished with value: 0.6015016351915915 and parameters: {'criterion': 'entropy', 'min_samples_split': 7, 'min_samples_leaf': 9, 'max_features': 'log2', 'n_estimators': 597, 'max_depth': 2.103302830511905}. Best is trial 112 with value: 0.6357983767809096.
[I 2023-04-16 08:24:36,171] Trial 121 finished with value: 0.6162678878617742 and parameters: {'criterion': 'entropy', 'min_samples_split': 3445, 'min_samples_leaf': 10, 'max_features': 'log2', 'n_estimators': 289, 'max_depth': 1.404292177814978}. Best is trial 112 with value: 0.6357983767809096.
[I 2023-04-16 08:24:39,361] Trial 122 finished with value: 0.6057088035690656 and parameters: {'criterion': 'entropy', 'min_samples_split': 1420, 'min_samples_leaf': 10, 'max_features': 'log2', 'n_estimators': 700, 'max_depth': 1.730334476304308}. Best is trial 112 with value: 0.6357983767809096.
[I 2023-04-16 08:24:42,152] Trial 123 finished with value: 0.6068186859234894 and parameters: {'criterion': 'entropy', 'min_samples_split': 4331, 'min_samples_leaf': 10, 'max_features': 'log2', 'n_estimators': 547, 'max_depth': 1.475085320617327}. Best is trial 112 with value: 0.6357983767809096.
[I 2023-04-16 08:24:42,916] Trial 124 finished with value: 0.5026593445370737 and parameters: {'criterion': 'entropy', 'min_samples_split': 6632, 'min_samples_leaf': 10, 'max_features': 'log2', 'n_estimators': 108, 'max_depth': 2.4725696565528112}. Best is trial 112 with value: 0.6357983767809096.
[I 2023-04-16 08:24:45,822] Trial 125 finished with value: 0.6093601643383303 and parameters: {'criterion': 'entropy', 'min_samples_split': 2566, 'min_samples_leaf': 10, 'max_features': 'log2', 'n_estimators': 634, 'max_depth': 1.188253884862136}. Best is trial 112 with value: 0.6357983767809096.
[I 2023-04-16 08:24:50,870] Trial 126 finished with value: 0.6393698368589198 and parameters: {'criterion': 'entropy', 'min_samples_split': 1227, 'min_samples_leaf': 10, 'max_features': 'log2', 'n_estimators': 1108, 'max_depth': 1.8148994249345274}. Best is trial 126 with value: 0.6393698368589198.
[I 2023-04-16 08:24:55,224] Trial 127 finished with value: 0.6066616886267542 and parameters: {'criterion': 'entropy', 'min_samples_split': 1253, 'min_samples_leaf': 10, 'max_features': 'log2', 'n_estimators': 680, 'max_depth': 2.207640419532104}. Best is trial 126 with value: 0.6393698368589198.
[I 2023-04-16 08:24:57,444] Trial 128 finished with value: 0.5026593445370737 and parameters: {'criterion': 'entropy', 'min_samples_split': 31690, 'min_samples_leaf': 9, 'max_features': 'sqrt', 'n_estimators': 793, 'max_depth': 1.8672706323529975}. Best is trial 126 with value: 0.6393698368589198.
[I 2023-04-16 08:24:58,823] Trial 129 finished with value: 0.5026593445370737 and parameters: {'criterion': 'entropy', 'min_samples_split': 24251, 'min_samples_leaf': 5, 'max_features': 'log2', 'n_estimators': 419, 'max_depth': 1.1580094870743713}. Best is trial 126 with value: 0.6393698368589198.
[I 2023-04-16 08:25:01,973] Trial 130 finished with value: 0.609599582852858 and parameters: {'criterion': 'entropy', 'min_samples_split': 911, 'min_samples_leaf': 10, 'max_features': 'log2', 'n_estimators': 486, 'max_depth': 2.7364452406048767}. Best is trial 126 with value: 0.6393698368589198.
[I 2023-04-16 08:25:07,290] Trial 131 finished with value: 0.6137268190324959 and parameters: {'criterion': 'entropy', 'min_samples_split': 3548, 'min_samples_leaf': 10, 'max_features': 'log2', 'n_estimators': 1225, 'max_depth': 1.5784795916807184}. Best is trial 126 with value: 0.6393698368589198.
[I 2023-04-16 08:25:12,261] Trial 132 finished with value: 0.6122974599393813 and parameters: {'criterion': 'entropy', 'min_samples_split': 5216, 'min_samples_leaf': 10, 'max_features': 'log2', 'n_estimators': 1089, 'max_depth': 1.3473196654990856}. Best is trial 126 with value: 0.6393698368589198.
[I 2023-04-16 08:25:16,700] Trial 133 finished with value: 0.6052310377637888 and parameters: {'criterion': 'entropy', 'min_samples_split': 1978, 'min_samples_leaf': 10, 'max_features': 'log2', 'n_estimators': 990, 'max_depth': 1.767298861585428}. Best is trial 126 with value: 0.6393698368589198.
[I 2023-04-16 08:25:20,657] Trial 134 finished with value: 0.6055493802655374 and parameters: {'criterion': 'entropy', 'min_samples_split': 2936, 'min_samples_leaf': 10, 'max_features': 'log2', 'n_estimators': 900, 'max_depth': 1.4208279886331052}. Best is trial 126 with value: 0.6393698368589198.
[I 2023-04-16 08:25:23,426] Trial 135 finished with value: 0.6001498768092655 and parameters: {'criterion': 'entropy', 'min_samples_split': 14, 'min_samples_leaf': 10, 'max_features': 'log2', 'n_estimators': 582, 'max_depth': 1.1441793167051273}. Best is trial 126 with value: 0.6393698368589198.
[I 2023-04-16 08:25:28,053] Trial 136 finished with value: 0.6304007007063775 and parameters: {'criterion': 'entropy', 'min_samples_split': 4350, 'min_samples_leaf': 9, 'max_features': 'log2', 'n_estimators': 1042, 'max_depth': 1.997919285529451}. Best is trial 126 with value: 0.6393698368589198.
[I 2023-04-16 08:25:31,251] Trial 137 finished with value: 0.6088034430392508 and parameters: {'criterion': 'entropy', 'min_samples_split': 3922, 'min_samples_leaf': 7, 'max_features': 'log2', 'n_estimators': 534, 'max_depth': 2.0426101720224734}. Best is trial 126 with value: 0.6393698368589198.
[I 2023-04-16 08:25:37,290] Trial 138 finished with value: 0.6019777941612002 and parameters: {'criterion': 'entropy', 'min_samples_split': 1710, 'min_samples_leaf': 9, 'max_features': 'log2', 'n_estimators': 833, 'max_depth': 3.4552179729838963}. Best is trial 126 with value: 0.6393698368589198.
[I 2023-04-16 08:25:39,149] Trial 139 finished with value: 0.6103132384355092 and parameters: {'criterion': 'entropy', 'min_samples_split': 4, 'min_samples_leaf': 9, 'max_features': 'log2', 'n_estimators': 373, 'max_depth': 1.725457034309227}. Best is trial 126 with value: 0.6393698368589198.
[I 2023-04-16 08:25:43,423] Trial 140 finished with value: 0.60276905045464 and parameters: {'criterion': 'entropy', 'min_samples_split': 1077, 'min_samples_leaf': 6, 'max_features': 'log2', 'n_estimators': 291, 'max_depth': 8.716651319224408}. Best is trial 126 with value: 0.6393698368589198.
[I 2023-04-16 08:25:48,435] Trial 141 finished with value: 0.6166636735414028 and parameters: {'criterion': 'entropy', 'min_samples_split': 5772, 'min_samples_leaf': 10, 'max_features': 'log2', 'n_estimators': 1145, 'max_depth': 1.2780764024050082}. Best is trial 126 with value: 0.6393698368589198.
[I 2023-04-16 08:25:52,994] Trial 142 finished with value: 0.6091221636199803 and parameters: {'criterion': 'log_loss', 'min_samples_split': 4625, 'min_samples_leaf': 10, 'max_features': 'log2', 'n_estimators': 1044, 'max_depth': 1.5170038271697366}. Best is trial 126 with value: 0.6393698368589198.
[I 2023-04-16 08:25:57,698] Trial 143 finished with value: 0.6088839738621398 and parameters: {'criterion': 'entropy', 'min_samples_split': 2596, 'min_samples_leaf': 10, 'max_features': 'log2', 'n_estimators': 1042, 'max_depth': 1.006011541879014}. Best is trial 126 with value: 0.6393698368589198.
[I 2023-04-16 08:26:04,258] Trial 144 finished with value: 0.6109477809914491 and parameters: {'criterion': 'entropy', 'min_samples_split': 3285, 'min_samples_leaf': 10, 'max_features': 'log2', 'n_estimators': 1104, 'max_depth': 2.298310465333381}. Best is trial 126 with value: 0.6393698368589198.
[I 2023-04-16 08:26:08,685] Trial 145 finished with value: 0.6101542247175435 and parameters: {'criterion': 'entropy', 'min_samples_split': 1519, 'min_samples_leaf': 10, 'max_features': 'log2', 'n_estimators': 1011, 'max_depth': 1.9259437898756078}. Best is trial 126 with value: 0.6393698368589198.
[I 2023-04-16 08:26:14,071] Trial 146 finished with value: 0.6342893060360308 and parameters: {'criterion': 'entropy', 'min_samples_split': 6296, 'min_samples_leaf': 9, 'max_features': 'log2', 'n_estimators': 1224, 'max_depth': 1.3256031522932532}. Best is trial 126 with value: 0.6393698368589198.
