[I 2023-04-16 08:26:17,315] Trial 147 finished with value: 0.6049931945783473 and parameters: {'criterion': 'entropy', 'min_samples_split': 4208, 'min_samples_leaf': 8, 'max_features': 'log2', 'n_estimators': 612, 'max_depth': 1.2376120973609017}. Best is trial 126 with value: 0.6393698368589198.
[I 2023-04-16 08:26:22,301] Trial 148 finished with value: 0.6083291744645456 and parameters: {'criterion': 'entropy', 'min_samples_split': 2222, 'min_samples_leaf': 9, 'max_features': 'log2', 'n_estimators': 943, 'max_depth': 1.6781908028558836}. Best is trial 126 with value: 0.6393698368589198.
[I 2023-04-16 08:26:23,839] Trial 149 finished with value: 0.5026593445370737 and parameters: {'criterion': 'entropy', 'min_samples_split': 6842, 'min_samples_leaf': 9, 'max_features': 'log2', 'n_estimators': 505, 'max_depth': 2.657273317936015}. Best is trial 126 with value: 0.6393698368589198.
[I 2023-04-16 08:26:33,021] Trial 150 finished with value: 0.554420656975242 and parameters: {'criterion': 'entropy', 'min_samples_split': 1057, 'min_samples_leaf': 9, 'max_features': 'sqrt', 'n_estimators': 1182, 'max_depth': 1.3467391999274894}. Best is trial 126 with value: 0.6393698368589198.
[I 2023-04-16 08:26:38,957] Trial 151 finished with value: 0.6334156285247989 and parameters: {'criterion': 'entropy', 'min_samples_split': 5252, 'min_samples_leaf': 10, 'max_features': 'log2', 'n_estimators': 1124, 'max_depth': 1.1303763559542956}. Best is trial 126 with value: 0.6393698368589198.
[I 2023-04-16 08:26:44,794] Trial 152 finished with value: 0.6138869984939854 and parameters: {'criterion': 'entropy', 'min_samples_split': 2774, 'min_samples_leaf': 10, 'max_features': 'log2', 'n_estimators': 1198, 'max_depth': 1.2053189987427044}. Best is trial 126 with value: 0.6393698368589198.
[I 2023-04-16 08:26:49,570] Trial 153 finished with value: 0.6127741545208794 and parameters: {'criterion': 'entropy', 'min_samples_split': 5496, 'min_samples_leaf': 10, 'max_features': 'log2', 'n_estimators': 1132, 'max_depth': 1.1579795430219508}. Best is trial 126 with value: 0.6393698368589198.
[I 2023-04-16 08:26:55,150] Trial 154 finished with value: 0.6174583325456687 and parameters: {'criterion': 'entropy', 'min_samples_split': 753, 'min_samples_leaf': 10, 'max_features': 'log2', 'n_estimators': 1257, 'max_depth': 1.0075004425195118}. Best is trial 126 with value: 0.6393698368589198.
[I 2023-04-16 08:27:38,091] Trial 155 finished with value: 0.6223743044922083 and parameters: {'criterion': 'entropy', 'min_samples_split': 2133, 'min_samples_leaf': 8, 'max_features': 'log2', 'n_estimators': 1026, 'max_depth': 58.89580106314626}. Best is trial 126 with value: 0.6393698368589198.
[I 2023-04-16 08:27:44,818] Trial 156 finished with value: 0.6079318449624126 and parameters: {'criterion': 'entropy', 'min_samples_split': 3811, 'min_samples_leaf': 9, 'max_features': 'log2', 'n_estimators': 1345, 'max_depth': 1.6289742246189025}. Best is trial 126 with value: 0.6393698368589198.
[I 2023-04-16 08:27:47,565] Trial 157 finished with value: 0.6059471508598147 and parameters: {'criterion': 'entropy', 'min_samples_split': 6034, 'min_samples_leaf': 10, 'max_features': 'log2', 'n_estimators': 441, 'max_depth': 1.4189291617720794}. Best is trial 126 with value: 0.6393698368589198.
[I 2023-04-16 08:27:50,215] Trial 158 finished with value: 0.5026593445370737 and parameters: {'criterion': 'entropy', 'min_samples_split': 27363, 'min_samples_leaf': 10, 'max_features': 'log2', 'n_estimators': 969, 'max_depth': 2.087476327537179}. Best is trial 126 with value: 0.6393698368589198.
[I 2023-04-16 08:28:04,663] Trial 159 finished with value: 0.6136438937093959 and parameters: {'criterion': 'entropy', 'min_samples_split': 832, 'min_samples_leaf': 9, 'max_features': 'log2', 'n_estimators': 663, 'max_depth': 16.767535751875254}. Best is trial 126 with value: 0.6393698368589198.
[I 2023-04-16 08:28:09,449] Trial 160 finished with value: 0.6059458275833822 and parameters: {'criterion': 'entropy', 'min_samples_split': 4650, 'min_samples_leaf': 10, 'max_features': 'log2', 'n_estimators': 1092, 'max_depth': 1.8455646803581287}. Best is trial 126 with value: 0.6393698368589198.
[I 2023-04-16 08:28:12,124] Trial 161 finished with value: 0.5026593445370737 and parameters: {'criterion': 'entropy', 'min_samples_split': 7605, 'min_samples_leaf': 10, 'max_features': 'log2', 'n_estimators': 1126, 'max_depth': 1.474165550358829}. Best is trial 126 with value: 0.6393698368589198.
[I 2023-04-16 08:28:17,227] Trial 162 finished with value: 0.6119008235820463 and parameters: {'criterion': 'entropy', 'min_samples_split': 2967, 'min_samples_leaf': 10, 'max_features': 'log2', 'n_estimators': 1235, 'max_depth': 1.1379467850956282}. Best is trial 126 with value: 0.6393698368589198.
[I 2023-04-16 08:28:22,312] Trial 163 finished with value: 0.6065017927245002 and parameters: {'criterion': 'log_loss', 'min_samples_split': 25, 'min_samples_leaf': 10, 'max_features': 'log2', 'n_estimators': 1167, 'max_depth': 1.000784014581375}. Best is trial 126 with value: 0.6393698368589198.
[I 2023-04-16 08:28:27,185] Trial 164 finished with value: 0.6263508131848743 and parameters: {'criterion': 'entropy', 'min_samples_split': 5038, 'min_samples_leaf': 10, 'max_features': 'log2', 'n_estimators': 1068, 'max_depth': 1.3708304367811546}. Best is trial 126 with value: 0.6393698368589198.
[I 2023-04-16 08:28:31,793] Trial 165 finished with value: 0.626987781747607 and parameters: {'criterion': 'entropy', 'min_samples_split': 1841, 'min_samples_leaf': 10, 'max_features': 'log2', 'n_estimators': 1063, 'max_depth': 1.31901599014838}. Best is trial 126 with value: 0.6393698368589198.
[I 2023-04-16 08:28:36,985] Trial 166 finished with value: 0.6092002054229128 and parameters: {'criterion': 'entropy', 'min_samples_split': 3852, 'min_samples_leaf': 10, 'max_features': 'log2', 'n_estimators': 1071, 'max_depth': 1.2693008103696513}. Best is trial 126 with value: 0.6393698368589198.
[I 2023-04-16 08:28:39,733] Trial 167 finished with value: 0.5026593445370737 and parameters: {'criterion': 'entropy', 'min_samples_split': 6512, 'min_samples_leaf': 10, 'max_features': 'log2', 'n_estimators': 977, 'max_depth': 1.397664548098822}. Best is trial 126 with value: 0.6393698368589198.
[I 2023-04-16 08:28:44,533] Trial 168 finished with value: 0.6149975109800437 and parameters: {'criterion': 'entropy', 'min_samples_split': 1958, 'min_samples_leaf': 10, 'max_features': 'log2', 'n_estimators': 1053, 'max_depth': 1.1386750377700166}. Best is trial 126 with value: 0.6393698368589198.
[I 2023-04-16 08:28:48,447] Trial 169 finished with value: 0.6173787784268133 and parameters: {'criterion': 'entropy', 'min_samples_split': 4432, 'min_samples_leaf': 10, 'max_features': 'log2', 'n_estimators': 915, 'max_depth': 1.5968699228974714}. Best is trial 126 with value: 0.6393698368589198.
[I 2023-04-16 08:28:51,043] Trial 170 finished with value: 0.5026593445370737 and parameters: {'criterion': 'entropy', 'min_samples_split': 9310, 'min_samples_leaf': 9, 'max_features': 'log2', 'n_estimators': 1021, 'max_depth': 1.3212119889484462}. Best is trial 126 with value: 0.6393698368589198.
[I 2023-04-16 08:28:56,940] Trial 171 finished with value: 0.6129334833046624 and parameters: {'criterion': 'entropy', 'min_samples_split': 1534, 'min_samples_leaf': 10, 'max_features': 'log2', 'n_estimators': 1450, 'max_depth': 1.8308082346235826}. Best is trial 126 with value: 0.6393698368589198.
[I 2023-04-16 08:29:00,621] Trial 172 finished with value: 0.6018995318121956 and parameters: {'criterion': 'entropy', 'min_samples_split': 2939, 'min_samples_leaf': 10, 'max_features': 'log2', 'n_estimators': 568, 'max_depth': 2.2816800858915025}. Best is trial 126 with value: 0.6393698368589198.
[I 2023-04-16 08:29:03,374] Trial 173 finished with value: 0.6372283660056586 and parameters: {'criterion': 'entropy', 'min_samples_split': 998, 'min_samples_leaf': 10, 'max_features': 'log2', 'n_estimators': 628, 'max_depth': 1.6615749441150411}. Best is trial 126 with value: 0.6393698368589198.
[I 2023-04-16 08:29:06,304] Trial 174 finished with value: 0.6266678324101904 and parameters: {'criterion': 'entropy', 'min_samples_split': 2041, 'min_samples_leaf': 10, 'max_features': 'log2', 'n_estimators': 707, 'max_depth': 1.5301562192391227}. Best is trial 126 with value: 0.6393698368589198.
[I 2023-04-16 08:29:09,362] Trial 175 finished with value: 0.6249216116246684 and parameters: {'criterion': 'entropy', 'min_samples_split': 1801, 'min_samples_leaf': 10, 'max_features': 'log2', 'n_estimators': 724, 'max_depth': 1.5341761152435296}. Best is trial 126 with value: 0.6393698368589198.
[I 2023-04-16 08:29:12,326] Trial 176 finished with value: 0.613884635500356 and parameters: {'criterion': 'entropy', 'min_samples_split': 680, 'min_samples_leaf': 10, 'max_features': 'log2', 'n_estimators': 702, 'max_depth': 1.0100834751267191}. Best is trial 126 with value: 0.6393698368589198.
[I 2023-04-16 08:29:16,495] Trial 177 finished with value: 0.5984062395634447 and parameters: {'criterion': 'entropy', 'min_samples_split': 2885, 'min_samples_leaf': 10, 'max_features': 'log2', 'n_estimators': 762, 'max_depth': 2.029998830507275}. Best is trial 126 with value: 0.6393698368589198.
[I 2023-04-16 08:29:22,278] Trial 178 finished with value: 0.5653804419743285 and parameters: {'criterion': 'entropy', 'min_samples_split': 1539, 'min_samples_leaf': 10, 'max_features': 'sqrt', 'n_estimators': 620, 'max_depth': 2.4950923098221445}. Best is trial 126 with value: 0.6393698368589198.
[I 2023-04-16 08:29:32,393] Trial 179 finished with value: 0.5992779951731916 and parameters: {'criterion': 'entropy', 'min_samples_split': 3540, 'min_samples_leaf': 4, 'max_features': 'log2', 'n_estimators': 1560, 'max_depth': 3.1212038057382774}. Best is trial 126 with value: 0.6393698368589198.
[I 2023-04-16 08:29:35,332] Trial 180 finished with value: 0.6293673478389635 and parameters: {'criterion': 'entropy', 'min_samples_split': 2231, 'min_samples_leaf': 9, 'max_features': 'log2', 'n_estimators': 698, 'max_depth': 1.1688406960277438}. Best is trial 126 with value: 0.6393698368589198.
[I 2023-04-16 08:29:38,109] Trial 181 finished with value: 0.6137274176575487 and parameters: {'criterion': 'entropy', 'min_samples_split': 2313, 'min_samples_leaf': 9, 'max_features': 'log2', 'n_estimators': 652, 'max_depth': 1.1726813333814687}. Best is trial 126 with value: 0.6393698368589198.
[I 2023-04-16 08:29:41,411] Trial 182 finished with value: 0.6159503645311506 and parameters: {'criterion': 'entropy', 'min_samples_split': 980, 'min_samples_leaf': 9, 'max_features': 'log2', 'n_estimators': 801, 'max_depth': 1.608594111281213}. Best is trial 126 with value: 0.6393698368589198.
[I 2023-04-16 08:29:44,315] Trial 183 finished with value: 0.6293669697599829 and parameters: {'criterion': 'entropy', 'min_samples_split': 2174, 'min_samples_leaf': 8, 'max_features': 'log2', 'n_estimators': 690, 'max_depth': 1.149864536458178}. Best is trial 126 with value: 0.6393698368589198.
[I 2023-04-16 08:29:47,915] Trial 184 finished with value: 0.6054698576532639 and parameters: {'criterion': 'entropy', 'min_samples_split': 3468, 'min_samples_leaf': 8, 'max_features': 'log2', 'n_estimators': 876, 'max_depth': 1.2578900059886193}. Best is trial 126 with value: 0.6393698368589198.
[I 2023-04-16 08:29:49,699] Trial 185 finished with value: 0.5026593445370737 and parameters: {'criterion': 'entropy', 'min_samples_split': 35231, 'min_samples_leaf': 7, 'max_features': 'log2', 'n_estimators': 683, 'max_depth': 29.57292282020435}. Best is trial 126 with value: 0.6393698368589198.
[I 2023-04-16 08:29:52,021] Trial 186 finished with value: 0.6133281662539305 and parameters: {'criterion': 'entropy', 'min_samples_split': 987, 'min_samples_leaf': 9, 'max_features': 'log2', 'n_estimators': 525, 'max_depth': 1.1244787592901015}. Best is trial 126 with value: 0.6393698368589198.
[I 2023-04-16 08:30:07,521] Trial 187 finished with value: 0.6217396359099416 and parameters: {'criterion': 'entropy', 'min_samples_split': 2530, 'min_samples_leaf': 9, 'max_features': 'log2', 'n_estimators': 457, 'max_depth': 158.63489210143973}. Best is trial 126 with value: 0.6393698368589198.
[I 2023-04-16 08:30:09,511] Trial 188 finished with value: 0.5026593445370737 and parameters: {'criterion': 'entropy', 'min_samples_split': 18049, 'min_samples_leaf': 8, 'max_features': 'log2', 'n_estimators': 754, 'max_depth': 1.001006534698091}. Best is trial 126 with value: 0.6393698368589198.
[I 2023-04-16 08:30:11,230] Trial 189 finished with value: 0.6140444053762831 and parameters: {'criterion': 'entropy', 'min_samples_split': 707, 'min_samples_leaf': 9, 'max_features': 'log2', 'n_estimators': 361, 'max_depth': 1.3151477170705277}. Best is trial 126 with value: 0.6393698368589198.
[I 2023-04-16 08:30:14,051] Trial 190 finished with value: 0.6066615941070089 and parameters: {'criterion': 'entropy', 'min_samples_split': 4474, 'min_samples_leaf': 10, 'max_features': 'log2', 'n_estimators': 637, 'max_depth': 1.8459300404809245}. Best is trial 126 with value: 0.6393698368589198.
[I 2023-04-16 08:30:17,633] Trial 191 finished with value: 0.6120590181288871 and parameters: {'criterion': 'entropy', 'min_samples_split': 36, 'min_samples_leaf': 10, 'max_features': 'log2', 'n_estimators': 838, 'max_depth': 1.553068557308851}. Best is trial 126 with value: 0.6393698368589198.
[I 2023-04-16 08:30:20,719] Trial 192 finished with value: 0.6105511446341141 and parameters: {'criterion': 'entropy', 'min_samples_split': 1705, 'min_samples_leaf': 10, 'max_features': 'log2', 'n_estimators': 702, 'max_depth': 1.1723950363218556}. Best is trial 126 with value: 0.6393698368589198.
[I 2023-04-16 08:30:23,333] Trial 193 finished with value: 0.6268270036610648 and parameters: {'criterion': 'entropy', 'min_samples_split': 2760, 'min_samples_leaf': 10, 'max_features': 'log2', 'n_estimators': 607, 'max_depth': 1.4516609697580904}. Best is trial 126 with value: 0.6393698368589198.
[I 2023-04-16 08:30:25,853] Trial 194 finished with value: 0.6041211869159466 and parameters: {'criterion': 'entropy', 'min_samples_split': 3275, 'min_samples_leaf': 10, 'max_features': 'log2', 'n_estimators': 560, 'max_depth': 1.3464045083053346}. Best is trial 126 with value: 0.6393698368589198.
[I 2023-04-16 08:30:31,427] Trial 195 finished with value: 0.608407940918858 and parameters: {'criterion': 'entropy', 'min_samples_split': 2204, 'min_samples_leaf': 10, 'max_features': 'log2', 'n_estimators': 595, 'max_depth': 5.330871379475955}. Best is trial 126 with value: 0.6393698368589198.
[I 2023-04-16 08:30:33,672] Trial 196 finished with value: 0.5993572657328116 and parameters: {'criterion': 'entropy', 'min_samples_split': 1411, 'min_samples_leaf': 10, 'max_features': 'log2', 'n_estimators': 486, 'max_depth': 1.720657052001635}. Best is trial 126 with value: 0.6393698368589198.
[I 2023-04-16 08:30:36,466] Trial 197 finished with value: 0.6297646773410965 and parameters: {'criterion': 'log_loss', 'min_samples_split': 3772, 'min_samples_leaf': 10, 'max_features': 'log2', 'n_estimators': 650, 'max_depth': 1.1621172756957114}. Best is trial 126 with value: 0.6393698368589198.
[I 2023-04-16 08:30:39,217] Trial 198 finished with value: 0.62055435830545 and parameters: {'criterion': 'log_loss', 'min_samples_split': 5505, 'min_samples_leaf': 9, 'max_features': 'log2', 'n_estimators': 645, 'max_depth': 1.118925682998966}. Best is trial 126 with value: 0.6393698368589198.
[I 2023-04-16 08:30:40,968] Trial 199 finished with value: 0.5026593445370737 and parameters: {'criterion': 'entropy', 'min_samples_split': 21864, 'min_samples_leaf': 9, 'max_features': 'log2', 'n_estimators': 685, 'max_depth': 1.2461337183675842}. Best is trial 126 with value: 0.6393698368589198.
[I 2023-04-16 08:30:48,065] Trial 200 finished with value: 0.6067380920874371 and parameters: {'criterion': 'log_loss', 'min_samples_split': 3846, 'min_samples_leaf': 10, 'max_features': 'log2', 'n_estimators': 409, 'max_depth': 13.254220005608323}. Best is trial 126 with value: 0.6393698368589198.
[I 2023-04-16 08:30:50,644] Trial 201 finished with value: 0.6212692741513701 and parameters: {'criterion': 'log_loss', 'min_samples_split': 39, 'min_samples_leaf': 10, 'max_features': 'log2', 'n_estimators': 611, 'max_depth': 1.4433640039543665}. Best is trial 126 with value: 0.6393698368589198.
[I 2023-04-16 08:30:53,089] Trial 202 finished with value: 0.6022957270773864 and parameters: {'criterion': 'log_loss', 'min_samples_split': 2349, 'min_samples_leaf': 10, 'max_features': 'log2', 'n_estimators': 539, 'max_depth': 1.1303827766333185}. Best is trial 126 with value: 0.6393698368589198.
[I 2023-04-16 08:30:55,940] Trial 203 finished with value: 0.5991183828301733 and parameters: {'criterion': 'log_loss', 'min_samples_split': 4622, 'min_samples_leaf': 10, 'max_features': 'log2', 'n_estimators': 662, 'max_depth': 1.0105074912083434}. Best is trial 126 with value: 0.6393698368589198.
[I 2023-04-16 08:30:58,498] Trial 204 finished with value: 0.5981663169436094 and parameters: {'criterion': 'entropy', 'min_samples_split': 3031, 'min_samples_leaf': 10, 'max_features': 'log2', 'n_estimators': 578, 'max_depth': 1.349879557666044}. Best is trial 126 with value: 0.6393698368589198.
[I 2023-04-16 08:31:02,116] Trial 205 finished with value: 0.6072174962349635 and parameters: {'criterion': 'entropy', 'min_samples_split': 1065, 'min_samples_leaf': 10, 'max_features': 'log2', 'n_estimators': 634, 'max_depth': 2.1015188925742976}. Best is trial 126 with value: 0.6393698368589198.
[I 2023-04-16 08:31:05,296] Trial 206 finished with value: 0.6216660050284505 and parameters: {'criterion': 'entropy', 'min_samples_split': 6079, 'min_samples_leaf': 10, 'max_features': 'log2', 'n_estimators': 745, 'max_depth': 1.636238570049233}. Best is trial 126 with value: 0.6393698368589198.
[I 2023-04-16 08:31:07,584] Trial 207 finished with value: 0.6280962463058534 and parameters: {'criterion': 'entropy', 'min_samples_split': 3829, 'min_samples_leaf': 8, 'max_features': 'log2', 'n_estimators': 504, 'max_depth': 1.9000894213342578}. Best is trial 126 with value: 0.6393698368589198.
[I 2023-04-16 08:31:09,797] Trial 208 finished with value: 0.6337334669212398 and parameters: {'criterion': 'entropy', 'min_samples_split': 4366, 'min_samples_leaf': 8, 'max_features': 'log2', 'n_estimators': 472, 'max_depth': 1.8612886623103044}. Best is trial 126 with value: 0.6393698368589198.
[I 2023-04-16 08:31:12,828] Trial 209 finished with value: 0.5568832429094438 and parameters: {'criterion': 'entropy', 'min_samples_split': 5151, 'min_samples_leaf': 8, 'max_features': 'sqrt', 'n_estimators': 448, 'max_depth': 1.9466317847104242}. Best is trial 126 with value: 0.6393698368589198.
[I 2023-04-16 08:31:14,197] Trial 210 finished with value: 0.5026593445370737 and parameters: {'criterion': 'entropy', 'min_samples_split': 6820, 'min_samples_leaf': 7, 'max_features': 'log2', 'n_estimators': 490, 'max_depth': 2.1807743973643317}. Best is trial 126 with value: 0.6393698368589198.
[I 2023-04-16 08:31:16,316] Trial 211 finished with value: 0.6290495724556859 and parameters: {'criterion': 'entropy', 'min_samples_split': 4103, 'min_samples_leaf': 8, 'max_features': 'log2', 'n_estimators': 425, 'max_depth': 1.7651160121400786}. Best is trial 126 with value: 0.6393698368589198.
[I 2023-04-16 08:31:18,643] Trial 212 finished with value: 0.5966563640144426 and parameters: {'criterion': 'entropy', 'min_samples_split': 4075, 'min_samples_leaf': 8, 'max_features': 'log2', 'n_estimators': 382, 'max_depth': 2.4718720558058904}. Best is trial 126 with value: 0.6393698368589198.
[I 2023-04-16 08:31:20,731] Trial 213 finished with value: 0.6180153374039837 and parameters: {'criterion': 'entropy', 'min_samples_split': 4204, 'min_samples_leaf': 8, 'max_features': 'log2', 'n_estimators': 430, 'max_depth': 1.7704958514631115}. Best is trial 126 with value: 0.6393698368589198.
[I 2023-04-16 08:31:22,336] Trial 214 finished with value: 0.6021351380303346 and parameters: {'criterion': 'entropy', 'min_samples_split': 5708, 'min_samples_leaf': 8, 'max_features': 'log2', 'n_estimators': 330, 'max_depth': 1.6723026511443448}. Best is trial 126 with value: 0.6393698368589198.
[I 2023-04-16 08:31:27,878] Trial 215 finished with value: 0.5986414361960214 and parameters: {'criterion': 'entropy', 'min_samples_split': 3448, 'min_samples_leaf': 8, 'max_features': 'log2', 'n_estimators': 500, 'max_depth': 6.993109436012332}. Best is trial 126 with value: 0.6393698368589198.
[I 2023-04-16 08:31:30,586] Trial 216 finished with value: 0.6026923319281398 and parameters: {'criterion': 'entropy', 'min_samples_split': 4867, 'min_samples_leaf': 8, 'max_features': 'log2', 'n_estimators': 458, 'max_depth': 2.7720382135312915}. Best is trial 126 with value: 0.6393698368589198.
[I 2023-04-16 08:31:32,911] Trial 217 finished with value: 0.6108673446883054 and parameters: {'criterion': 'entropy', 'min_samples_split': 986, 'min_samples_leaf': 8, 'max_features': 'log2', 'n_estimators': 524, 'max_depth': 1.962317423440257}. Best is trial 126 with value: 0.6393698368589198.
[I 2023-04-16 08:31:34,128] Trial 218 finished with value: 0.5026593445370737 and parameters: {'criterion': 'entropy', 'min_samples_split': 7993, 'min_samples_leaf': 8, 'max_features': 'log2', 'n_estimators': 387, 'max_depth': 1.1961749571957654}. Best is trial 126 with value: 0.6393698368589198.
[I 2023-04-16 08:31:40,294] Trial 219 finished with value: 0.6048332986760935 and parameters: {'criterion': 'entropy', 'min_samples_split': 2967, 'min_samples_leaf': 7, 'max_features': 'log2', 'n_estimators': 459, 'max_depth': 8.691638863893012}. Best is trial 126 with value: 0.6393698368589198.
