[I 2023-04-16 08:31:42,711] Trial 220 finished with value: 0.6329399421539159 and parameters: {'criterion': 'log_loss', 'min_samples_split': 1882, 'min_samples_leaf': 8, 'max_features': 'log2', 'n_estimators': 529, 'max_depth': 1.5512861629498147}. Best is trial 126 with value: 0.6393698368589198.
[I 2023-04-16 08:31:45,074] Trial 221 finished with value: 0.5928455799416498 and parameters: {'criterion': 'log_loss', 'min_samples_split': 1978, 'min_samples_leaf': 8, 'max_features': 'log2', 'n_estimators': 519, 'max_depth': 1.5187449464300526}. Best is trial 126 with value: 0.6393698368589198.
[I 2023-04-16 08:31:54,198] Trial 222 finished with value: 0.6044394664045318 and parameters: {'criterion': 'log_loss', 'min_samples_split': 784, 'min_samples_leaf': 8, 'max_features': 'log2', 'n_estimators': 1720, 'max_depth': 2.2239154675658908}. Best is trial 126 with value: 0.6393698368589198.
[I 2023-04-16 08:31:56,626] Trial 223 finished with value: 0.6106316754570029 and parameters: {'criterion': 'log_loss', 'min_samples_split': 3694, 'min_samples_leaf': 8, 'max_features': 'log2', 'n_estimators': 570, 'max_depth': 1.3230890576787393}. Best is trial 126 with value: 0.6393698368589198.
[I 2023-04-16 08:32:01,247] Trial 224 finished with value: 0.6035667655973332 and parameters: {'criterion': 'log_loss', 'min_samples_split': 2384, 'min_samples_leaf': 3, 'max_features': 'log2', 'n_estimators': 548, 'max_depth': 4.137151287089632}. Best is trial 126 with value: 0.6393698368589198.
[I 2023-04-16 08:32:19,055] Trial 225 finished with value: 0.6255484665746674 and parameters: {'criterion': 'log_loss', 'min_samples_split': 1164, 'min_samples_leaf': 8, 'max_features': 'log2', 'n_estimators': 429, 'max_depth': 1754.2469262542293}. Best is trial 126 with value: 0.6393698368589198.
[I 2023-04-16 08:32:21,239] Trial 226 finished with value: 0.60713724897131 and parameters: {'criterion': 'entropy', 'min_samples_split': 115, 'min_samples_leaf': 8, 'max_features': 'log2', 'n_estimators': 497, 'max_depth': 1.7343729092486286}. Best is trial 126 with value: 0.6393698368589198.
[I 2023-04-16 08:32:28,529] Trial 227 finished with value: 0.6061831981700977 and parameters: {'criterion': 'entropy', 'min_samples_split': 4873, 'min_samples_leaf': 9, 'max_features': 'log2', 'n_estimators': 482, 'max_depth': 450.9259821750289}. Best is trial 126 with value: 0.6393698368589198.
[I 2023-04-16 08:32:31,412] Trial 228 finished with value: 0.630558139095257 and parameters: {'criterion': 'entropy', 'min_samples_split': 2960, 'min_samples_leaf': 7, 'max_features': 'log2', 'n_estimators': 667, 'max_depth': 1.178362953532028}. Best is trial 126 with value: 0.6393698368589198.
[I 2023-04-16 08:32:34,225] Trial 229 finished with value: 0.6311145453285192 and parameters: {'criterion': 'entropy', 'min_samples_split': 3426, 'min_samples_leaf': 7, 'max_features': 'log2', 'n_estimators': 676, 'max_depth': 1.5011169707713756}. Best is trial 126 with value: 0.6393698368589198.
[I 2023-04-16 08:32:37,094] Trial 230 finished with value: 0.6199999684934182 and parameters: {'criterion': 'entropy', 'min_samples_split': 2945, 'min_samples_leaf': 7, 'max_features': 'log2', 'n_estimators': 676, 'max_depth': 1.5019056759494573}. Best is trial 126 with value: 0.6393698368589198.
[I 2023-04-16 08:32:40,051] Trial 231 finished with value: 0.6223807003282986 and parameters: {'criterion': 'entropy', 'min_samples_split': 4008, 'min_samples_leaf': 6, 'max_features': 'log2', 'n_estimators': 712, 'max_depth': 1.8637478132773617}. Best is trial 126 with value: 0.6393698368589198.
[I 2023-04-16 08:32:42,883] Trial 232 finished with value: 0.6195239040435547 and parameters: {'criterion': 'entropy', 'min_samples_split': 5974, 'min_samples_leaf': 7, 'max_features': 'log2', 'n_estimators': 664, 'max_depth': 1.1121199073323838}. Best is trial 126 with value: 0.6393698368589198.
[I 2023-04-16 08:32:45,625] Trial 233 finished with value: 0.6283350661953283 and parameters: {'criterion': 'entropy', 'min_samples_split': 1926, 'min_samples_leaf': 6, 'max_features': 'log2', 'n_estimators': 618, 'max_depth': 1.3231485547187258}. Best is trial 126 with value: 0.6393698368589198.
[I 2023-04-16 08:32:48,440] Trial 234 finished with value: 0.6074547723019339 and parameters: {'criterion': 'entropy', 'min_samples_split': 1735, 'min_samples_leaf': 5, 'max_features': 'log2', 'n_estimators': 643, 'max_depth': 1.2942182868347145}. Best is trial 126 with value: 0.6393698368589198.
[I 2023-04-16 08:32:50,110] Trial 235 finished with value: 0.5026593445370737 and parameters: {'criterion': 'entropy', 'min_samples_split': 39645, 'min_samples_leaf': 6, 'max_features': 'log2', 'n_estimators': 616, 'max_depth': 1.4911597539035468}. Best is trial 126 with value: 0.6393698368589198.
[I 2023-04-16 08:32:52,594] Trial 236 finished with value: 0.6032467532467531 and parameters: {'criterion': 'entropy', 'min_samples_split': 2473, 'min_samples_leaf': 7, 'max_features': 'log2', 'n_estimators': 587, 'max_depth': 1.0069472562389752}. Best is trial 126 with value: 0.6393698368589198.
[I 2023-04-16 08:32:55,520] Trial 237 finished with value: 0.6309543658670296 and parameters: {'criterion': 'entropy', 'min_samples_split': 1397, 'min_samples_leaf': 6, 'max_features': 'log2', 'n_estimators': 699, 'max_depth': 1.225372598056756}. Best is trial 126 with value: 0.6393698368589198.
[I 2023-04-16 08:32:58,673] Trial 238 finished with value: 0.6222216235971694 and parameters: {'criterion': 'entropy', 'min_samples_split': 59, 'min_samples_leaf': 7, 'max_features': 'log2', 'n_estimators': 728, 'max_depth': 1.16972513093832}. Best is trial 126 with value: 0.6393698368589198.
[I 2023-04-16 08:33:01,956] Trial 239 finished with value: 0.6142035136139941 and parameters: {'criterion': 'entropy', 'min_samples_split': 1198, 'min_samples_leaf': 7, 'max_features': 'log2', 'n_estimators': 797, 'max_depth': 1.580424142101104}. Best is trial 126 with value: 0.6393698368589198.
[I 2023-04-16 08:33:04,875] Trial 240 finished with value: 0.6081692785622917 and parameters: {'criterion': 'entropy', 'min_samples_split': 3118, 'min_samples_leaf': 6, 'max_features': 'log2', 'n_estimators': 685, 'max_depth': 1.239660087710407}. Best is trial 126 with value: 0.6393698368589198.
[I 2023-04-16 08:33:08,192] Trial 241 finished with value: 0.6108678803001947 and parameters: {'criterion': 'entropy', 'min_samples_split': 1707, 'min_samples_leaf': 6, 'max_features': 'log2', 'n_estimators': 762, 'max_depth': 1.346972219153478}. Best is trial 126 with value: 0.6393698368589198.
[I 2023-04-16 08:33:31,750] Trial 242 finished with value: 0.623881894427746 and parameters: {'criterion': 'entropy', 'min_samples_split': 1319, 'min_samples_leaf': 5, 'max_features': 'log2', 'n_estimators': 659, 'max_depth': 48.16314301112966}. Best is trial 126 with value: 0.6393698368589198.
[I 2023-04-16 08:33:34,720] Trial 243 finished with value: 0.622460033901082 and parameters: {'criterion': 'entropy', 'min_samples_split': 2173, 'min_samples_leaf': 7, 'max_features': 'log2', 'n_estimators': 719, 'max_depth': 1.1316349735100322}. Best is trial 126 with value: 0.6393698368589198.
[I 2023-04-16 08:33:37,392] Trial 244 finished with value: 0.6081671046081526 and parameters: {'criterion': 'entropy', 'min_samples_split': 804, 'min_samples_leaf': 6, 'max_features': 'log2', 'n_estimators': 624, 'max_depth': 1.4049040661531427}. Best is trial 126 with value: 0.6393698368589198.
[I 2023-04-16 08:34:08,705] Trial 245 finished with value: 0.6164220495661544 and parameters: {'criterion': 'entropy', 'min_samples_split': 3087, 'min_samples_leaf': 9, 'max_features': 'log2', 'n_estimators': 1286, 'max_depth': 25.31815790924507}. Best is trial 126 with value: 0.6393698368589198.
[I 2023-04-16 08:34:13,332] Trial 246 finished with value: 0.6148384657554964 and parameters: {'criterion': 'entropy', 'min_samples_split': 2239, 'min_samples_leaf': 6, 'max_features': 'log2', 'n_estimators': 1182, 'max_depth': 1.654864783854773}. Best is trial 126 with value: 0.6393698368589198.
[I 2023-04-16 08:34:16,217] Trial 247 finished with value: 0.6026923949413032 and parameters: {'criterion': 'log_loss', 'min_samples_split': 4826, 'min_samples_leaf': 6, 'max_features': 'log2', 'n_estimators': 678, 'max_depth': 1.2740656083651107}. Best is trial 126 with value: 0.6393698368589198.
[I 2023-04-16 08:34:18,904] Trial 248 finished with value: 0.6316691871932046 and parameters: {'criterion': 'entropy', 'min_samples_split': 123, 'min_samples_leaf': 5, 'max_features': 'log2', 'n_estimators': 624, 'max_depth': 1.001660299114292}. Best is trial 126 with value: 0.6393698368589198.
[I 2023-04-16 08:34:21,309] Trial 249 finished with value: 0.6138039786511402 and parameters: {'criterion': 'entropy', 'min_samples_split': 38, 'min_samples_leaf': 9, 'max_features': 'log2', 'n_estimators': 560, 'max_depth': 1.0331830253392482}. Best is trial 126 with value: 0.6393698368589198.
[I 2023-04-16 08:34:25,832] Trial 250 finished with value: 0.6119014537136808 and parameters: {'criterion': 'entropy', 'min_samples_split': 1101, 'min_samples_leaf': 5, 'max_features': 'log2', 'n_estimators': 1130, 'max_depth': 1.1465339389576548}. Best is trial 126 with value: 0.6393698368589198.
[I 2023-04-16 08:34:30,295] Trial 251 finished with value: 0.5555345721721267 and parameters: {'criterion': 'entropy', 'min_samples_split': 95, 'min_samples_leaf': 5, 'max_features': 'sqrt', 'n_estimators': 715, 'max_depth': 1.555913361960625}. Best is trial 126 with value: 0.6393698368589198.
[I 2023-04-16 08:34:33,080] Trial 252 finished with value: 0.6377031071790897 and parameters: {'criterion': 'entropy', 'min_samples_split': 3891, 'min_samples_leaf': 5, 'max_features': 'log2', 'n_estimators': 651, 'max_depth': 1.0246262353914497}. Best is trial 126 with value: 0.6393698368589198.
[I 2023-04-16 08:34:35,942] Trial 253 finished with value: 0.6257149473525019 and parameters: {'criterion': 'entropy', 'min_samples_split': 4278, 'min_samples_leaf': 5, 'max_features': 'log2', 'n_estimators': 660, 'max_depth': 1.0146514811726237}. Best is trial 126 with value: 0.6393698368589198.
[I 2023-04-16 08:34:39,186] Trial 254 finished with value: 0.6233333333333334 and parameters: {'criterion': 'entropy', 'min_samples_split': 5454, 'min_samples_leaf': 5, 'max_features': 'log2', 'n_estimators': 752, 'max_depth': 1.0099133684896662}. Best is trial 126 with value: 0.6393698368589198.
[I 2023-04-16 08:34:41,032] Trial 255 finished with value: 0.5026593445370737 and parameters: {'criterion': 'entropy', 'min_samples_split': 14592, 'min_samples_leaf': 5, 'max_features': 'log2', 'n_estimators': 692, 'max_depth': 10.972220834598708}. Best is trial 126 with value: 0.6393698368589198.
[I 2023-04-16 08:34:43,603] Trial 256 finished with value: 0.6231751387864926 and parameters: {'criterion': 'log_loss', 'min_samples_split': 3563, 'min_samples_leaf': 10, 'max_features': 'log2', 'n_estimators': 599, 'max_depth': 1.2181063632263631}. Best is trial 126 with value: 0.6393698368589198.
[I 2023-04-16 08:34:45,283] Trial 257 finished with value: 0.5026593445370737 and parameters: {'criterion': 'entropy', 'min_samples_split': 6916, 'min_samples_leaf': 5, 'max_features': 'log2', 'n_estimators': 647, 'max_depth': 1.13729468132848}. Best is trial 126 with value: 0.6393698368589198.
[I 2023-04-16 08:34:48,050] Trial 258 finished with value: 0.6319083851616603 and parameters: {'criterion': 'entropy', 'min_samples_split': 2829, 'min_samples_leaf': 5, 'max_features': 'log2', 'n_estimators': 634, 'max_depth': 1.4035829253448693}. Best is trial 126 with value: 0.6393698368589198.
[I 2023-04-16 08:34:50,754] Trial 259 finished with value: 0.6084877155837856 and parameters: {'criterion': 'entropy', 'min_samples_split': 2852, 'min_samples_leaf': 5, 'max_features': 'log2', 'n_estimators': 612, 'max_depth': 1.426828437690871}. Best is trial 126 with value: 0.6393698368589198.
[I 2023-04-16 08:34:53,600] Trial 260 finished with value: 0.6034837142479065 and parameters: {'criterion': 'entropy', 'min_samples_split': 1552, 'min_samples_leaf': 5, 'max_features': 'log2', 'n_estimators': 684, 'max_depth': 1.206327914667902}. Best is trial 126 with value: 0.6393698368589198.
[I 2023-04-16 08:34:56,361] Trial 261 finished with value: 0.6115827646395331 and parameters: {'criterion': 'entropy', 'min_samples_split': 2812, 'min_samples_leaf': 5, 'max_features': 'log2', 'n_estimators': 640, 'max_depth': 1.3878161332412373}. Best is trial 126 with value: 0.6393698368589198.
[I 2023-04-16 08:34:59,519] Trial 262 finished with value: 0.6185713970648468 and parameters: {'criterion': 'entropy', 'min_samples_split': 3595, 'min_samples_leaf': 4, 'max_features': 'log2', 'n_estimators': 729, 'max_depth': 1.0068640760210026}. Best is trial 126 with value: 0.6393698368589198.
[I 2023-04-16 08:35:02,036] Trial 263 finished with value: 0.6068182763379271 and parameters: {'criterion': 'entropy', 'min_samples_split': 1298, 'min_samples_leaf': 5, 'max_features': 'log2', 'n_estimators': 577, 'max_depth': 1.1662768297166983}. Best is trial 126 with value: 0.6393698368589198.
[I 2023-04-16 08:35:04,773] Trial 264 finished with value: 0.6229375791602866 and parameters: {'criterion': 'log_loss', 'min_samples_split': 2473, 'min_samples_leaf': 10, 'max_features': 'log2', 'n_estimators': 641, 'max_depth': 1.4961079562127413}. Best is trial 126 with value: 0.6393698368589198.
[I 2023-04-16 08:35:09,599] Trial 265 finished with value: 0.6095968732868297 and parameters: {'criterion': 'entropy', 'min_samples_split': 4793, 'min_samples_leaf': 5, 'max_features': 'log2', 'n_estimators': 1227, 'max_depth': 1.2747585428311288}. Best is trial 126 with value: 0.6393698368589198.
[I 2023-04-16 08:35:15,911] Trial 266 finished with value: 0.6016596722055237 and parameters: {'criterion': 'entropy', 'min_samples_split': 966, 'min_samples_leaf': 10, 'max_features': 'log2', 'n_estimators': 936, 'max_depth': 3.7333559836231687}. Best is trial 126 with value: 0.6393698368589198.
[I 2023-04-16 08:35:19,303] Trial 267 finished with value: 0.6079316559229223 and parameters: {'criterion': 'entropy', 'min_samples_split': 6274, 'min_samples_leaf': 10, 'max_features': 'log2', 'n_estimators': 772, 'max_depth': 19.448637916168273}. Best is trial 126 with value: 0.6393698368589198.
[I 2023-04-16 08:35:23,590] Trial 268 finished with value: 0.5520421936142459 and parameters: {'criterion': 'entropy', 'min_samples_split': 2167, 'min_samples_leaf': 10, 'max_features': 'sqrt', 'n_estimators': 708, 'max_depth': 1.6318481217480538}. Best is trial 126 with value: 0.6393698368589198.
[I 2023-04-16 08:35:27,121] Trial 269 finished with value: 0.6025324045193041 and parameters: {'criterion': 'entropy', 'min_samples_split': 3477, 'min_samples_leaf': 10, 'max_features': 'log2', 'n_estimators': 603, 'max_depth': 2.09186141683834}. Best is trial 126 with value: 0.6393698368589198.
[I 2023-04-16 08:35:29,975] Trial 270 finished with value: 0.6208743076428667 and parameters: {'criterion': 'entropy', 'min_samples_split': 874, 'min_samples_leaf': 5, 'max_features': 'log2', 'n_estimators': 674, 'max_depth': 1.004432118704346}. Best is trial 126 with value: 0.6393698368589198.
[I 2023-04-16 08:35:34,445] Trial 271 finished with value: 0.6265887823966427 and parameters: {'criterion': 'entropy', 'min_samples_split': 5208, 'min_samples_leaf': 10, 'max_features': 'log2', 'n_estimators': 1107, 'max_depth': 1.350990154672086}. Best is trial 126 with value: 0.6393698368589198.
[I 2023-04-16 08:35:36,921] Trial 272 finished with value: 0.6186458471174628 and parameters: {'criterion': 'entropy', 'min_samples_split': 2009, 'min_samples_leaf': 10, 'max_features': 'log2', 'n_estimators': 545, 'max_depth': 1.1648148351704535}. Best is trial 126 with value: 0.6393698368589198.
[I 2023-04-16 08:35:54,000] Trial 273 finished with value: 0.6084845964321948 and parameters: {'criterion': 'log_loss', 'min_samples_split': 4219, 'min_samples_leaf': 10, 'max_features': 'log2', 'n_estimators': 867, 'max_depth': 94.99254898072704}. Best is trial 126 with value: 0.6393698368589198.
[I 2023-04-16 08:35:57,680] Trial 274 finished with value: 0.6041213129422737 and parameters: {'criterion': 'entropy', 'min_samples_split': 42, 'min_samples_leaf': 10, 'max_features': 'log2', 'n_estimators': 639, 'max_depth': 2.365892048089857}. Best is trial 126 with value: 0.6393698368589198.
[I 2023-04-16 08:36:00,183] Trial 275 finished with value: 0.611344669401438 and parameters: {'criterion': 'entropy', 'min_samples_split': 3024, 'min_samples_leaf': 5, 'max_features': 'log2', 'n_estimators': 582, 'max_depth': 1.4984009925272976}. Best is trial 126 with value: 0.6393698368589198.
[I 2023-04-16 08:36:03,219] Trial 276 finished with value: 0.6140450985210811 and parameters: {'criterion': 'entropy', 'min_samples_split': 1692, 'min_samples_leaf': 10, 'max_features': 'log2', 'n_estimators': 694, 'max_depth': 1.722271944811041}. Best is trial 126 with value: 0.6393698368589198.
[I 2023-04-16 08:36:05,176] Trial 277 finished with value: 0.5026593445370737 and parameters: {'criterion': 'entropy', 'min_samples_split': 46766, 'min_samples_leaf': 7, 'max_features': 'log2', 'n_estimators': 814, 'max_depth': 1.1758993695121451}. Best is trial 126 with value: 0.6393698368589198.
[I 2023-04-16 08:36:11,866] Trial 278 finished with value: 0.597452125749069 and parameters: {'criterion': 'entropy', 'min_samples_split': 2859, 'min_samples_leaf': 10, 'max_features': 'log2', 'n_estimators': 740, 'max_depth': 5.400940173976699}. Best is trial 126 with value: 0.6393698368589198.
[I 2023-04-16 08:37:07,814] Trial 279 finished with value: 0.6298350945512518 and parameters: {'criterion': 'entropy', 'min_samples_split': 886, 'min_samples_leaf': 10, 'max_features': 'log2', 'n_estimators': 1356, 'max_depth': 1524.9010025435116}. Best is trial 126 with value: 0.6393698368589198.
[I 2023-04-16 08:38:00,503] Trial 280 finished with value: 0.6321369023989112 and parameters: {'criterion': 'entropy', 'min_samples_split': 817, 'min_samples_leaf': 4, 'max_features': 'log2', 'n_estimators': 1165, 'max_depth': 821.5524421788485}. Best is trial 126 with value: 0.6393698368589198.
[I 2023-04-16 08:38:50,687] Trial 281 finished with value: 0.6302320144678223 and parameters: {'criterion': 'entropy', 'min_samples_split': 1026, 'min_samples_leaf': 4, 'max_features': 'log2', 'n_estimators': 1185, 'max_depth': 716.1107487592241}. Best is trial 126 with value: 0.6393698368589198.
[I 2023-04-16 08:39:39,906] Trial 282 finished with value: 0.6331689319898927 and parameters: {'criterion': 'entropy', 'min_samples_split': 998, 'min_samples_leaf': 4, 'max_features': 'log2', 'n_estimators': 1172, 'max_depth': 510.20869161854023}. Best is trial 126 with value: 0.6393698368589198.
[I 2023-04-16 08:40:52,795] Trial 283 finished with value: 0.6306286193185756 and parameters: {'criterion': 'entropy', 'min_samples_split': 728, 'min_samples_leaf': 4, 'max_features': 'log2', 'n_estimators': 1401, 'max_depth': 991.5413053358363}. Best is trial 126 with value: 0.6393698368589198.
[I 2023-04-16 08:42:04,454] Trial 284 finished with value: 0.6410265474457615 and parameters: {'criterion': 'entropy', 'min_samples_split': 16, 'min_samples_leaf': 4, 'max_features': 'log2', 'n_estimators': 1372, 'max_depth': 843.5773671317828}. Best is trial 284 with value: 0.6410265474457615.
[I 2023-04-16 08:43:09,602] Trial 285 finished with value: 0.6319780777204358 and parameters: {'criterion': 'entropy', 'min_samples_split': 701, 'min_samples_leaf': 4, 'max_features': 'log2', 'n_estimators': 1395, 'max_depth': 867.1839828751952}. Best is trial 284 with value: 0.6410265474457615.
[I 2023-04-16 08:44:16,515] Trial 286 finished with value: 0.6311047152750209 and parameters: {'criterion': 'entropy', 'min_samples_split': 731, 'min_samples_leaf': 4, 'max_features': 'log2', 'n_estimators': 1465, 'max_depth': 835.2270865371065}. Best is trial 284 with value: 0.6410265474457615.
[I 2023-04-16 08:45:24,176] Trial 287 finished with value: 0.6322953489984057 and parameters: {'criterion': 'entropy', 'min_samples_split': 610, 'min_samples_leaf': 3, 'max_features': 'log2', 'n_estimators': 1442, 'max_depth': 961.8802382510596}. Best is trial 284 with value: 0.6410265474457615.
[I 2023-04-16 08:46:32,595] Trial 288 finished with value: 0.6324541736768812 and parameters: {'criterion': 'entropy', 'min_samples_split': 601, 'min_samples_leaf': 3, 'max_features': 'log2', 'n_estimators': 1489, 'max_depth': 856.2711243082462}. Best is trial 284 with value: 0.6410265474457615.
[I 2023-04-16 08:47:50,639] Trial 289 finished with value: 0.639518043819354 and parameters: {'criterion': 'entropy', 'min_samples_split': 60, 'min_samples_leaf': 3, 'max_features': 'log2', 'n_estimators': 1450, 'max_depth': 937.9186135873448}. Best is trial 284 with value: 0.6410265474457615.
[I 2023-04-16 08:49:05,840] Trial 290 finished with value: 0.6405502939564075 and parameters: {'criterion': 'entropy', 'min_samples_split': 109, 'min_samples_leaf': 3, 'max_features': 'log2', 'n_estimators': 1477, 'max_depth': 896.6408175355941}. Best is trial 284 with value: 0.6410265474457615.
[I 2023-04-16 08:50:59,590] Trial 291 finished with value: 0.6344364417726863 and parameters: {'criterion': 'entropy', 'min_samples_split': 472, 'min_samples_leaf': 3, 'max_features': 'sqrt', 'n_estimators': 1488, 'max_depth': 894.8365263260823}. Best is trial 284 with value: 0.6410265474457615.
[I 2023-04-16 08:52:13,566] Trial 292 finished with value: 0.6398351890709969 and parameters: {'criterion': 'entropy', 'min_samples_split': 19, 'min_samples_leaf': 3, 'max_features': 'log2', 'n_estimators': 1448, 'max_depth': 1070.5261478955842}. Best is trial 284 with value: 0.6410265474457615.
