[I 2023-04-16 11:21:49,172] Trial 367 finished with value: 0.6432468162599168 and parameters: {'criterion': 'gini', 'min_samples_split': 19, 'min_samples_leaf': 2, 'max_features': 'sqrt', 'n_estimators': 1821, 'max_depth': 1981.983240313507}. Best is trial 364 with value: 0.6449137349792371.
[I 2023-04-16 11:24:20,635] Trial 368 finished with value: 0.6446757342608871 and parameters: {'criterion': 'gini', 'min_samples_split': 13, 'min_samples_leaf': 2, 'max_features': 'sqrt', 'n_estimators': 1764, 'max_depth': 1781.8283189017363}. Best is trial 364 with value: 0.6449137349792371.
[I 2023-04-16 11:24:24,690] Trial 369 finished with value: 0.5026593445370737 and parameters: {'criterion': 'gini', 'min_samples_split': 15726, 'min_samples_leaf': 1, 'max_features': 'sqrt', 'n_estimators': 1807, 'max_depth': 1948.0246038021553}. Best is trial 364 with value: 0.6449137349792371.
[I 2023-04-16 11:24:28,789] Trial 370 finished with value: 0.5026593445370737 and parameters: {'criterion': 'gini', 'min_samples_split': 26296, 'min_samples_leaf': 2, 'max_features': 'sqrt', 'n_estimators': 1830, 'max_depth': 1697.8696082385868}. Best is trial 364 with value: 0.6449137349792371.
[I 2023-04-16 11:26:08,373] Trial 371 finished with value: 0.6210235228139158 and parameters: {'criterion': 'gini', 'min_samples_split': 1914, 'min_samples_leaf': 2, 'max_features': 'sqrt', 'n_estimators': 1724, 'max_depth': 1950.2051790445503}. Best is trial 364 with value: 0.6449137349792371.
[I 2023-04-16 11:28:38,974] Trial 372 finished with value: 0.6422942147614638 and parameters: {'criterion': 'gini', 'min_samples_split': 2, 'min_samples_leaf': 2, 'max_features': 'sqrt', 'n_estimators': 1687, 'max_depth': 1522.0123031981127}. Best is trial 364 with value: 0.6449137349792371.
[I 2023-04-16 11:30:36,557] Trial 373 finished with value: 0.6298340863406366 and parameters: {'criterion': 'gini', 'min_samples_split': 1036, 'min_samples_leaf': 2, 'max_features': 'sqrt', 'n_estimators': 1755, 'max_depth': 1741.2003169702284}. Best is trial 364 with value: 0.6449137349792371.
[I 2023-04-16 11:32:20,545] Trial 374 finished with value: 0.6299925959532946 and parameters: {'criterion': 'gini', 'min_samples_split': 978, 'min_samples_leaf': 2, 'max_features': 'sqrt', 'n_estimators': 1623, 'max_depth': 1365.825478280091}. Best is trial 364 with value: 0.6449137349792371.
[I 2023-04-16 11:33:57,455] Trial 375 finished with value: 0.6212620591441553 and parameters: {'criterion': 'gini', 'min_samples_split': 1937, 'min_samples_leaf': 2, 'max_features': 'sqrt', 'n_estimators': 1767, 'max_depth': 1549.0927400729968}. Best is trial 364 with value: 0.6449137349792371.
[I 2023-04-16 11:35:41,230] Trial 376 finished with value: 0.6315798345274328 and parameters: {'criterion': 'gini', 'min_samples_split': 895, 'min_samples_leaf': 2, 'max_features': 'sqrt', 'n_estimators': 1641, 'max_depth': 1348.031239318913}. Best is trial 364 with value: 0.6449137349792371.
[I 2023-04-16 11:37:24,198] Trial 377 finished with value: 0.6228495812775289 and parameters: {'criterion': 'gini', 'min_samples_split': 1855, 'min_samples_leaf': 2, 'max_features': 'sqrt', 'n_estimators': 1802, 'max_depth': 1993.889559570544}. Best is trial 364 with value: 0.6449137349792371.
[I 2023-04-16 11:40:19,369] Trial 378 finished with value: 0.6499950219600875 and parameters: {'criterion': 'gini', 'min_samples_split': 41, 'min_samples_leaf': 1, 'max_features': 'sqrt', 'n_estimators': 1905, 'max_depth': 1689.3152270505443}. Best is trial 378 with value: 0.6499950219600875.
�訡��: �� 㤠���� ���� ����� "13768".
[W 2023-04-16 11:41:17,784] Trial 379 failed with parameters: {'criterion': 'gini', 'min_samples_split': 988, 'min_samples_leaf': 2, 'max_features': 'sqrt', 'n_estimators': 1909, 'max_depth': 1702.837639355428} because of the following error: KeyboardInterrupt().
Traceback (most recent call last):
  File "D:\vkr_folder\venv\lib\site-packages\optuna\study\_optimize.py", line 200, in _run_trial
    value_or_values = func(trial)
  File "D:\vkr_folder\classifiers\optimize\optimize.py", line 68, in <lambda>
    print("Best hyperparameters: {}".format(trial.params))
  File "D:\vkr_folder\classifiers\optimize\optimize.py", line 26, in objective
    max_features='sqrt')
  File "D:\vkr_folder\venv\lib\site-packages\sklearn\model_selection\_validation.py", line 515, in cross_val_score
    cv_results = cross_validate(
  File "D:\vkr_folder\venv\lib\site-packages\sklearn\model_selection\_validation.py", line 266, in cross_validate
    results = parallel(
  File "D:\vkr_folder\venv\lib\site-packages\sklearn\utils\parallel.py", line 63, in __call__
    return super().__call__(iterable_with_config)
  File "D:\vkr_folder\venv\lib\site-packages\joblib\parallel.py", line 1098, in __call__
    self.retrieve()
  File "D:\vkr_folder\venv\lib\site-packages\joblib\parallel.py", line 975, in retrieve
    self._output.extend(job.get(timeout=self.timeout))
  File "D:\vkr_folder\venv\lib\site-packages\joblib\_parallel_backends.py", line 567, in wrap_future_result
    return future.result(timeout=timeout)
  File "C:\Users\Dmitrii\AppData\Local\Programs\Python\Python310\lib\concurrent\futures\_base.py", line 441, in result
    self._condition.wait(timeout)
  File "C:\Users\Dmitrii\AppData\Local\Programs\Python\Python310\lib\threading.py", line 320, in wait
    waiter.acquire()
KeyboardInterrupt
[W 2023-04-16 11:41:17,791] Trial 379 failed with value None.
Traceback (most recent call last):
  File "D:\vkr_folder\classifiers\optimize\optimize.py", line 68, in <module>
    print("Best hyperparameters: {}".format(trial.params))
  File "D:\vkr_folder\venv\lib\site-packages\optuna\study\study.py", line 425, in optimize
    _optimize(
  File "D:\vkr_folder\venv\lib\site-packages\optuna\study\_optimize.py", line 66, in _optimize
    _optimize_sequential(
  File "D:\vkr_folder\venv\lib\site-packages\optuna\study\_optimize.py", line 163, in _optimize_sequential
    frozen_trial = _run_trial(study, func, catch)
  File "D:\vkr_folder\venv\lib\site-packages\optuna\study\_optimize.py", line 251, in _run_trial
    raise func_err
  File "D:\vkr_folder\venv\lib\site-packages\optuna\study\_optimize.py", line 200, in _run_trial
    value_or_values = func(trial)
  File "D:\vkr_folder\classifiers\optimize\optimize.py", line 68, in <lambda>
    print("Best hyperparameters: {}".format(trial.params))
  File "D:\vkr_folder\classifiers\optimize\optimize.py", line 26, in objective
    max_features='sqrt')
  File "D:\vkr_folder\venv\lib\site-packages\sklearn\model_selection\_validation.py", line 515, in cross_val_score
    cv_results = cross_validate(
  File "D:\vkr_folder\venv\lib\site-packages\sklearn\model_selection\_validation.py", line 266, in cross_validate
    results = parallel(
  File "D:\vkr_folder\venv\lib\site-packages\sklearn\utils\parallel.py", line 63, in __call__
    return super().__call__(iterable_with_config)
  File "D:\vkr_folder\venv\lib\site-packages\joblib\parallel.py", line 1098, in __call__
    self.retrieve()
  File "D:\vkr_folder\venv\lib\site-packages\joblib\parallel.py", line 975, in retrieve
    self._output.extend(job.get(timeout=self.timeout))
  File "D:\vkr_folder\venv\lib\site-packages\joblib\_parallel_backends.py", line 567, in wrap_future_result
    return future.result(timeout=timeout)
  File "C:\Users\Dmitrii\AppData\Local\Programs\Python\Python310\lib\concurrent\futures\_base.py", line 441, in result
    self._condition.wait(timeout)
  File "C:\Users\Dmitrii\AppData\Local\Programs\Python\Python310\lib\threading.py", line 320, in wait
    waiter.acquire()
KeyboardInterrupt

Process finished with exit code -1073741510 (0xC000013A: interrupted by Ctrl+C)
